{
  "schema_version": 1,
  "milestone": "M6.2",
  "kind": "crosswalk-evidence-work-queue",
  "source_path": "catalog/crosswalk/index.json",
  "semantics": {
    "priority": "Research-order recommendation; not a support claim or support-likelihood estimate.",
    "unassessed": "No reviewed mapping is recorded; this does not mean unsupported."
  },
  "priority_order": [
    "high",
    "medium",
    "low"
  ],
  "summary": {
    "total": 56,
    "high": 46,
    "medium": 6,
    "low": 4
  },
  "items": [
    {
      "id": "abbs:bbs.command",
      "host": "abbs",
      "host_name": "ABBS ARexx",
      "host_evidence_class": "documented-sdk",
      "operation": "bbs.command",
      "status": "unassessed",
      "priority": "high",
      "reasons": [
        "host has documented SDK or protocol evidence",
        "operation has a reviewed mapping in another host",
        "host census or archive evidence is already cataloged"
      ]
    },
    {
      "id": "abbs:lifecycle.exit",
      "host": "abbs",
      "host_name": "ABBS ARexx",
      "host_evidence_class": "documented-sdk",
      "operation": "lifecycle.exit",
      "status": "unassessed",
      "priority": "high",
      "reasons": [
        "host has documented SDK or protocol evidence",
        "operation has a reviewed mapping in another host",
        "host has a related reviewed operation in the same family",
        "operation is foundational for terminal, session, or lifecycle behavior",
        "host census or archive evidence is already cataloged"
      ]
    },
    {
      "id": "aedoor:bbs.command",
      "host": "aedoor",
      "host_name": "AmiExpress/AEDoor",
      "host_evidence_class": "documented-sdk",
      "operation": "bbs.command",
      "status": "unassessed",
      "priority": "high",
      "reasons": [
        "host has documented SDK or protocol evidence",
        "operation has a reviewed mapping in another host",
        "host census or archive evidence is already cataloged"
      ]
    },
    {
      "id": "aedoor:lifecycle.disconnect",
      "host": "aedoor",
      "host_name": "AmiExpress/AEDoor",
      "host_evidence_class": "documented-sdk",
      "operation": "lifecycle.disconnect",
      "status": "unassessed",
      "priority": "high",
      "reasons": [
        "host has documented SDK or protocol evidence",
        "operation has reviewed mappings in at least three other hosts",
        "operation is foundational for terminal, session, or lifecycle behavior",
        "host census or archive evidence is already cataloged"
      ]
    },
    {
      "id": "aedoor:lifecycle.exit",
      "host": "aedoor",
      "host_name": "AmiExpress/AEDoor",
      "host_evidence_class": "documented-sdk",
      "operation": "lifecycle.exit",
      "status": "unassessed",
      "priority": "high",
      "reasons": [
        "host has documented SDK or protocol evidence",
        "operation has a reviewed mapping in another host",
        "operation is foundational for terminal, session, or lifecycle behavior",
        "host census or archive evidence is already cataloged"
      ]
    },
    {
      "id": "aedoor:session.identity",
      "host": "aedoor",
      "host_name": "AmiExpress/AEDoor",
      "host_evidence_class": "documented-sdk",
      "operation": "session.identity",
      "status": "unassessed",
      "priority": "high",
      "reasons": [
        "host has documented SDK or protocol evidence",
        "operation has reviewed mappings in at least three other hosts",
        "operation is foundational for terminal, session, or lifecycle behavior",
        "host census or archive evidence is already cataloged"
      ]
    },
    {
      "id": "aedoor:session.time_left",
      "host": "aedoor",
      "host_name": "AmiExpress/AEDoor",
      "host_evidence_class": "documented-sdk",
      "operation": "session.time_left",
      "status": "unassessed",
      "priority": "high",
      "reasons": [
        "host has documented SDK or protocol evidence",
        "operation has reviewed mappings in at least three other hosts",
        "host census or archive evidence is already cataloged"
      ]
    },
    {
      "id": "aedoor:status.set",
      "host": "aedoor",
      "host_name": "AmiExpress/AEDoor",
      "host_evidence_class": "documented-sdk",
      "operation": "status.set",
      "status": "unassessed",
      "priority": "high",
      "reasons": [
        "host has documented SDK or protocol evidence",
        "operation has a reviewed mapping in another host",
        "host census or archive evidence is already cataloged"
      ]
    },
    {
      "id": "aedoor:terminal.read_key",
      "host": "aedoor",
      "host_name": "AmiExpress/AEDoor",
      "host_evidence_class": "documented-sdk",
      "operation": "terminal.read_key",
      "status": "unassessed",
      "priority": "high",
      "reasons": [
        "host has documented SDK or protocol evidence",
        "operation has reviewed mappings in at least three other hosts",
        "operation is foundational for terminal, session, or lifecycle behavior",
        "host census or archive evidence is already cataloged"
      ]
    },
    {
      "id": "aedoor:terminal.read_line",
      "host": "aedoor",
      "host_name": "AmiExpress/AEDoor",
      "host_evidence_class": "documented-sdk",
      "operation": "terminal.read_line",
      "status": "unassessed",
      "priority": "high",
      "reasons": [
        "host has documented SDK or protocol evidence",
        "operation has reviewed mappings in at least three other hosts",
        "operation is foundational for terminal, session, or lifecycle behavior",
        "host census or archive evidence is already cataloged"
      ]
    },
    {
      "id": "aedoor:terminal.write",
      "host": "aedoor",
      "host_name": "AmiExpress/AEDoor",
      "host_evidence_class": "documented-sdk",
      "operation": "terminal.write",
      "status": "unassessed",
      "priority": "high",
      "reasons": [
        "host has documented SDK or protocol evidence",
        "operation has reviewed mappings in at least three other hosts",
        "operation is foundational for terminal, session, or lifecycle behavior",
        "host census or archive evidence is already cataloged"
      ]
    },
    {
      "id": "ambos:bbs.command",
      "host": "ambos",
      "host_name": "AmBoS bbs.library",
      "host_evidence_class": "documented-sdk",
      "operation": "bbs.command",
      "status": "unassessed",
      "priority": "high",
      "reasons": [
        "host has documented SDK or protocol evidence",
        "operation has a reviewed mapping in another host",
        "host census or archive evidence is already cataloged"
      ]
    },
    {
      "id": "ambos:lifecycle.exit",
      "host": "ambos",
      "host_name": "AmBoS bbs.library",
      "host_evidence_class": "documented-sdk",
      "operation": "lifecycle.exit",
      "status": "unassessed",
      "priority": "high",
      "reasons": [
        "host has documented SDK or protocol evidence",
        "operation has a reviewed mapping in another host",
        "host has a related reviewed operation in the same family",
        "operation is foundational for terminal, session, or lifecycle behavior",
        "host census or archive evidence is already cataloged"
      ]
    },
    {
      "id": "ambos:session.identity",
      "host": "ambos",
      "host_name": "AmBoS bbs.library",
      "host_evidence_class": "documented-sdk",
      "operation": "session.identity",
      "status": "unassessed",
      "priority": "high",
      "reasons": [
        "host has documented SDK or protocol evidence",
        "operation has reviewed mappings in at least three other hosts",
        "operation is foundational for terminal, session, or lifecycle behavior",
        "host census or archive evidence is already cataloged"
      ]
    },
    {
      "id": "ambos:session.time_left",
      "host": "ambos",
      "host_name": "AmBoS bbs.library",
      "host_evidence_class": "documented-sdk",
      "operation": "session.time_left",
      "status": "unassessed",
      "priority": "high",
      "reasons": [
        "host has documented SDK or protocol evidence",
        "operation has reviewed mappings in at least three other hosts",
        "host census or archive evidence is already cataloged"
      ]
    },
    {
      "id": "ambos:status.set",
      "host": "ambos",
      "host_name": "AmBoS bbs.library",
      "host_evidence_class": "documented-sdk",
      "operation": "status.set",
      "status": "unassessed",
      "priority": "high",
      "reasons": [
        "host has documented SDK or protocol evidence",
        "operation has a reviewed mapping in another host",
        "host census or archive evidence is already cataloged"
      ]
    },
    {
      "id": "door-io:bbs.command",
      "host": "door-io",
      "host_name": "door_io.library",
      "host_evidence_class": "documented-sdk",
      "operation": "bbs.command",
      "status": "unassessed",
      "priority": "high",
      "reasons": [
        "host has documented SDK or protocol evidence",
        "operation has a reviewed mapping in another host",
        "host census or archive evidence is already cataloged"
      ]
    },
    {
      "id": "door-io:lifecycle.disconnect",
      "host": "door-io",
      "host_name": "door_io.library",
      "host_evidence_class": "documented-sdk",
      "operation": "lifecycle.disconnect",
      "status": "unassessed",
      "priority": "high",
      "reasons": [
        "host has documented SDK or protocol evidence",
        "operation has reviewed mappings in at least three other hosts",
        "operation is foundational for terminal, session, or lifecycle behavior",
        "host census or archive evidence is already cataloged"
      ]
    },
    {
      "id": "door-io:lifecycle.exit",
      "host": "door-io",
      "host_name": "door_io.library",